<?xml version="1.0" encoding="UTF-8"?>
<!--

     xmlium-web, is an extension for selenium-java test framework allowing for tests
     to be described in xml files.

     The contents of this file are subject GNU Lesser General Public License
     Version 3 or later, you may not use this file except in compliance
     with the License.

     You may obtain a copy of the License at:
     https://www.gnu.org/licenses/lgpl.html

     Software distributed under the License is distributed on an "AS IS" basis,
     WITHOUT WARRANTY OF ANY KIND, either express or implied. See the License
     for the specific language governing rights and limitations under the
     License.

-->
<schema xmlns="http://www.w3.org/2001/XMLSchema" xmlns:xsi="http://www.w3.org/2001/XMLSchema-instance" targetNamespace="http://www.xmlium.org/xsd/1.0/TestConfig" xmlns:tns="http://www.xmlium.org/xsd/1.0/TestConfig" elementFormDefault="qualified">
   
   	<element name="testConfig" type="tns:Config"/>
   	
    <complexType name="Config">
    	<sequence>
    		<element name="pathString" type="string" minOccurs="0" maxOccurs="1"/>
    		<element name="driverClass" type="string" maxOccurs="1"/>
    		<element name="appId" type="string" minOccurs="0" maxOccurs="1"/>
    		<element name="appApk" type="string" minOccurs="0" maxOccurs="1"/>
    		<element name="timeout" type="long" maxOccurs="1"/>
    		<element name="timeUnit" type="string" maxOccurs="1"/>
    		<element name="url" type="string" minOccurs="0" maxOccurs="1"/>
    		<element name="fluentWaitIgnore" type="tns:FluentWaitIgnore" maxOccurs="1"/>
    		<element name="locale" type="string" maxOccurs="1"/>
    		<element name="delay" type="integer" maxOccurs="1"/>
    		<element name="unformat" type="boolean" minOccurs="0" maxOccurs="1"/>
    	</sequence>
    </complexType>
    <complexType name="FluentWaitIgnore">
    	<sequence>
    			<element name="exceptionClassNames" type="tns:FluentWaitExceptionsList"/>
    	</sequence>
    </complexType>

     <simpleType name="FluentWaitExceptionsList">
    		<list itemType="string"/>
    </simpleType>
</schema>